572,572,572,572,572,572,572,572,572,572,572,572,572,572,572,572,572,572,572,,,,,,,,,,,,,"I don’t get that. If you’re an active trader ok, but a long term investor…doesn’t make any sense. If I bought MSFT at $305, and today at $288, not good to add small?",negative
573,573,573,573,573,573,573,573,573,573,573,573,573,573,573,573,573,573,573,,,,,,,,,,,,,You clearly don't know how senior interviews are conducted in top tier companies and what all responsibilities a sde3 has in amazon/google/msft.,negative
574,574,574,574,574,574,574,574,574,574,574,574,574,574,574,574,574,574,574,,,,,,,,,,,,,Microsoft $MSFT IV index mean is at 33 compared to 52-week range of 16 to 48 with 15 strikes trading more than 1K contracts - Services &amp; Tools -&gt; Analysis Services -&gt; Basic/Advanced Options -&gt; Basic Options,negative
575,575,575,575,575,575,575,575,575,575,575,575,575,575,575,575,575,575,575,,,,,,,,,,,,,"Think of the frustration of AWS engineers or sales. To know your biz is doing great, but you stock bonus (which is large % of comp) has done nothing. Competitors at $GOOG or $MSFT have seen same $ bonus awards grow faster than at $AMZN the last 2-3 years.",postive
583,583,583,583,583,583,583,583,583,583,583,583,583,583,583,583,583,583,583,,,,,,,,,,,,,Wall Street - U.S.A. Markets Better Valuation For $JPM $BRK.B $BRK.A $BLK $BK $BX $GS $MS $BAC $WFC $SAN $SCHW $QQQ $VOYA $V $MA $AXP $FB $AAPL $AMZN $NFLX $GOOGL $TWTR $SQ $MSFT $IBM $INTC $TSLA $RIVN $F $GM $LCID $LAD $GE,postive
584,584,584,584,584,584,584,584,584,584,584,584,584,584,584,584,584,584,584,,,,,,,,,,,,,Which is the Best Thing To Do Today to Survive? Buy a Deere Tractor and Become a US Farmer $PYPL $QQQ $SPY $TSLA #news #putin #biden #technology #finance #investing #RussianUkrainianWar $AAPL $MSFT $NVDA $DE $FB $GM $F $TSLA $RIVN #inflation #commodities,neutral
585,585,585,585,585,585,585,585,585,585,585,585,585,585,585,585,585,585,585,,,,,,,,,,,,,$MSFT - CALLS Golden Sweep on strike 290 for expiration 2022-05-20 with total premium of 1349.82K (OI : 2647 volume : 2436 IV : 0.353084),postive
586,586,586,586,586,586,586,586,586,586,586,586,586,586,586,586,586,586,586,,,,,,,,,,,,,"Can we, gamers and fans, set expectations for Xbox and their handling of all these studios &amp; publishers. And what are those expectations. I know MSFT shareholders/CEO have expectations. This way we can *gauge* how successful Xbox is in meeting their own expectations, and ours",postive
588,588,588,588,588,588,588,588,588,588,588,588,588,588,588,588,588,588,588,,,,,,,,,,,,,Markets hammered again so tune in to #FastMarket at 12 pm ET on to help navigate the moves. and I will look at $MSFT and $FB. from will cover data on $DKNG and $PENN.,negative
589,589,589,589,589,589,589,589,589,589,589,589,589,589,589,589,589,589,589,,,,,,,,,,,,,"$MSFT I was hopeful for big cap tech to make a stand, however it failed to take back the 50ma, close below its 200ma, and is now below its 21ma and 8ema, with an unconfirmed stochastic sell signal on the daily chart. a close below the recent low, suggest resume downtrend",negative
590,590,590,590,590,590,590,590,590,590,590,590,590,590,590,590,590,590,590,,,,,,,,,,,,,How many people out there need an edge for their #DayTrading strategy? I like to use option order flow. Some of my favorite stocks to play: $SPY $MSFT $QQQ $SQ $NVDA $BAC #trading #finance #markets #business #OptionsTrading #Daytrader #Finance #fintwit,neutral
591,591,591,591,591,591,591,591,591,591,591,591,591,591,591,591,591,591,591,,,,,,,,,,,,,What's the Real Inflation Rate Today? 2024 World Forecast Pointing to 59% $PYPL $QQQ $SPY $TSLA #news #putin #biden #technology #finance #investing #RussianUkrainianWar $AAPL $MSFT $NVDA $AMZN $FB $GM $F $TSLA $RIVN #inflation,negative
593,593,593,593,593,593,593,593,593,593,593,593,593,593,593,593,593,593,593,,,,,,,,,,,,,$msft helped give clues yesterday that traders needed to reduce risk and switch gears again.,negative
596,596,596,596,596,596,596,596,596,596,596,596,596,596,596,596,596,596,596,,,,,,,,,,,,,"assumptions, before we cause microsofts stocks to collapse over unproven accusations (reminder Bill doesnt run msft anymore), kno that Epst was a skilled black mailer, most of his victims didnt know how shady he really was, just being in a room with him your careers now over.",negative
597,597,597,597,597,597,597,597,597,597,597,597,597,597,597,597,597,597,597,,,,,,,,,,,,,"An Amazing example of how all the ""MSFT Legos"" come together with #microsoftteams and #powerbi GOALS functionality which gives you lots of ""Citizens"" options with notifications",neutral
598,598,598,598,598,598,598,598,598,598,598,598,598,598,598,598,598,598,598,,,,,,,,,,,,,First time commuting to work on the Msft Connector in two years 😯,negative
599,599,599,599,599,599,599,599,599,599,599,599,599,599,599,599,599,599,599,,,,,,,,,,,,,LIMITED TIME OFFER: Get 3 free stocks valued up to $6300 by opening &amp; funding a #Webull brokerage account! Get started &gt; $TSLA $AAPL $MSFT $QS $FB $GM $F $RIVN $HOOD $LCID $NIO #buythedip,negative
600,600,600,600,600,600,600,600,600,600,600,600,600,600,600,600,600,600,600,,,,,,,,,,,,,The Democrat political party believes they should be able pick an age &amp; dictate that Americans die at that age The pro-KKK Admin lied to Democrat voters Claimed would fight the COVID-Bioweapon that these same Dems funded cc $AAPL $GOOGL $AMZN $MSFT,negative
605,605,605,605,605,605,605,605,605,605,605,605,605,605,605,605,605,605,605,,,,,,,,,,,,,Given the amount that gets pirated I reckon this is going to cost MSFT about $50.,negative
606,606,606,606,606,606,606,606,606,606,606,606,606,606,606,606,606,606,606,,,,,,,,,,,,,$MSFT - Microsoft to suspend new sales in Russia amid invasion,negative
607,607,607,607,607,607,607,607,607,607,607,607,607,607,607,607,607,607,607,,,,,,,,,,,,,Mohnish Pabrai: How to Find the Next 100-Bagger Stock $MSFT $AMZN $HKSE:00700 $GE $IBM $BOM:500247 $SBUX $SZSE:002594 $FB $AAPL $BABA $GOOG $GOOGL $BRK.B $BRK.A $BIDU $MCD $CMG $F #stocks #investing #valueinvesting #Value #Growth,postive
608,608,608,608,608,608,608,608,608,608,608,608,608,608,608,608,608,608,608,,,,,,,,,,,,,Most active NASDAQ listed stocks so far today Dollar Volume: $QQQ Tesla $TSLA Apple $AAPL $AMD Amazon $AMZN Nvidia $NVDA Microsoft $MSFT $TQQQ $SQQQ Meta $FB Volume: $VEON $GRAB American $AAL $SOFI Ocugen $OCGN United $UAL Lucid $LCID Sundial $SNDL Marvell $MRVL Rivian $RIVN,postive
609,609,609,609,609,609,609,609,609,609,609,609,609,609,609,609,609,609,609,,,,,,,,,,,,,"Recorded a podcast last night &amp; my truly esteemed guest shared inspiring insight on Microsoft &amp; Satya Nadella's transformative influence. Weeks away from publishing, but I can't wait. MSFT is a true #leadership standout.",neutral
610,610,610,610,610,610,610,610,610,610,610,610,610,610,610,610,610,610,610,,,,,,,,,,,,,It looks like the companies will stay separate publicly but the CEO reports into MSFT? I'm waiting for an official note from my broker.,neutral
612,612,612,612,612,612,612,612,612,612,612,612,612,612,612,612,612,612,612,,,,,,,,,,,,,HELP! My Portfolio is Crashing Daily. Is There A Bottom? Sure! Einstein Says Zero $PYPL $QQQ $SPY $TSLA #news #putin #biden #technology #finance #investing #RussianUkrainianWar $AAPL $MSFT $NVDA $AMZN $FB $GM $F $TSLA $RIVN $LCID $NIO,negative
613,613,613,613,613,613,613,613,613,613,613,613,613,613,613,613,613,613,613,,,,,,,,,,,,,"$MSFT Join today to get FREE access to our options, stock, and crypto trades as well as active trade commentary.",neutral
614,614,614,614,614,614,614,614,614,614,614,614,614,614,614,614,614,614,614,,,,,,,,,,,,,"Microsoft completes acquisition of Nuance, ushering in new era of outcomes-based AI $MSFT $NUAN",postive
615,615,615,615,615,615,615,615,615,615,615,615,615,615,615,615,615,615,,,,,,,,,,,,,,3/4 #alert #results con’t $ba 185P 1.46 to 1.93 $msft 290P 1.03 to 1.65 $xom 87.5C 2.51 to 3.15 (3/3) $ba 182.5P .96 to 1.65 🚨SMALL GAINS ADDS UP🚨 Join a service that shows the actual ENTRIES and EXITS not the PEAK $nflx $amzn $tsla JOIN &amp; TRADE OUR POWERFUL WATCHLIST,postive
616,616,616,616,616,616,616,616,616,616,616,616,616,616,616,616,616,616,,,,,,,,,,,,,,What is likely to make a real impact is the cancellation of the licenses of all existing MSFT products and get out of the contracts with little or no notice.,negative
617,617,617,617,617,617,617,617,617,617,617,617,617,617,617,617,617,617,,,,,,,,,,,,,,Silicon Valley is pulling its most popular products and services from Russia $AAPL $GOOGL $ABNB $MSFT $FB,negative
618,618,618,618,618,618,618,618,618,618,618,618,618,618,618,618,618,618,,,,,,,,,,,,,,Have day traded 17-days this year so far &amp; have only banked $10k total profits as of today. (only trading small with $28k for now). Need to do better &amp; be smarter about entries. Let's hope that after today this market settles down. $NFLX $MSFT $COST $NVDA $INTC $KO $TSLA,neutral
619,619,619,619,619,619,619,619,619,619,619,619,619,619,619,619,619,619,,,,,,,,,,,,,,Or get competition authorities to provide documents on a software provider apart from MSFT. Apparently choice only goes so far.,postive
620,620,620,620,620,620,620,620,620,620,620,620,620,620,620,620,620,620,,,,,,,,,,,,,,Best and worst performing Dow Jones stocks so far today Best: 1 Chevron $CVX 2 $PG 3 Amgen $AMGN 4 Walgreens $WBA 5 Intel $INTC 6 Verizon $VZ 7 Walmart $WMT Worst: 1 Visa $V 2 Disney $DIS 3 American Express $AXP 4 JPMorgan $JPM 5 Boeing $BA 6 Apple $AAPL 7 Microsoft $MSFT,neutral
621,621,621,621,621,621,621,621,621,621,621,621,621,621,621,621,621,621,,,,,,,,,,,,,,Early watchlist results $SNAP .26 to 1.19 (still running) 526% $MSFT Did not trigger but dumped HARD 285s ran over 120% $HOOD Did not trigger but ran up about 2% at open ran over 70% With the everything going on entire had to be safe. But if you took any you wouldn't of lost.,postive
622,622,622,622,622,622,622,622,622,622,622,622,622,622,622,622,622,622,,,,,,,,,,,,,,$MSFT: Microsoft completes acquisition of Nuance Communications (NUAN),postive
623,623,623,623,623,623,623,623,623,623,623,623,623,623,623,623,623,623,,,,,,,,,,,,,,Most Active EQTY Option Highest % Vol Increase $MSFT Contracts:100509 Vol ^ %96.38 Calls %54.54 Puts %45.46 Highest Daily Vol $LCID Contracts:98488 Vol ^ %150.31 Calls %46.12 Puts %53.88,postive
624,624,624,624,624,624,624,624,624,624,624,624,624,624,624,624,624,624,,,,,,,,,,,,,,"I would 100% not be where I am in my career (or life) without A true friend, mentor, and inspiration. This is such a loss for MSFT but I’m excited to see what comes next!",negative
625,625,625,625,625,625,625,625,625,625,625,625,625,625,625,625,625,625,,,,,,,,,,,,,,"Ignore $MSFT (was a foolish overnight) Numbers are small, but that's on purpose. I need to get consistent and content again. That's what I'm working on. Today I pulled out of trades when I hit the stop loss and even exited when price action was messy. I'm happy w/my performance",negative
626,626,626,626,626,626,626,626,626,626,626,626,626,626,626,626,626,626,,,,,,,,,,,,,,"How To Become a Millionaire Today? First, Sell Everything, then Sell-Short Every Day. NO-RISK $PYPL $QQQ $SPY $TSLA #news #putin #biden #technology #finance #investing #RussianUkrainianWar $AAPL $MSFT $NVDA $AMZN $FB $GM $F $TSLA $RIVN $LCID $NIO",postive
627,627,627,627,627,627,627,627,627,627,627,627,627,627,627,627,627,627,,,,,,,,,,,,,,The End of the REST API for On-Premises Mailboxes Preview - Microsoft Tech Community #MSExchange,neutral
628,628,628,628,628,628,628,628,628,628,628,628,628,628,628,628,628,628,,,,,,,,,,,,,,$shop How low can you go ? Shop was one of my big Short ideas at the start of the year. Its still grossly overvalued. Its Not a second $msft. It never was a msft. ordinary bubble. It will Go Back a the way b4 Corona Bubble. As all Other Stocks $tsla,negative
629,629,629,629,629,629,629,629,629,629,629,629,629,629,629,629,629,629,,,,,,,,,,,,,,"MSFT Pic of the trade brigade trade from my view of how it would look w/ all my crap on the screen hard bounce to resistance VWAP, 20 EMS &amp; PM lo spike in VIX &amp; SPY dropping. Pretty much everything I trade acted similar",negative
630,630,630,630,630,630,630,630,630,630,630,630,630,630,630,630,630,630,,,,,,,,,,,,,,Warren Buffett's Berkshire Hathaway Is Trouncing the S&amp;P 500 This Year $AAPL $MSFT $GOOG $AMZN $TSLA,negative
631,631,631,631,631,631,631,631,631,631,631,631,631,631,631,631,631,631,,,,,,,,,,,,,,*MICROSOFT TO SUSPEND NEW SALES OF PRODUCTS &amp; SERVICES IN RUSSIA - BBG $MSFT 🇺🇲 🇷🇺,negative
632,632,632,632,632,632,632,632,632,632,632,632,632,632,632,632,632,632,,,,,,,,,,,,,,"As we get closer to IE11 retirement (June 15, 2022), highly recommend learning about Cloud Site List Management to manage site lists for IE mode with #Microsoft365 admin center",postive
634,634,634,634,634,634,634,634,634,634,634,634,634,634,634,634,634,634,,,,,,,,,,,,,,"Is it open for internal MSFT transfer? Also, will this allow international relocation?",postive
635,635,635,635,635,635,635,635,635,635,635,635,635,635,635,635,635,635,,,,,,,,,,,,,,"$aapl $msft, $fb candles coming for these pieces of shit",negative
636,636,636,636,636,636,636,636,636,636,636,636,636,636,636,636,636,636,,,,,,,,,,,,,,"Is the Bull Market Over? Yes, Sell Everything and Don't Come Back Ever Again! $PYPL $QQQ $SPY $TSLA #news #putin #biden #technology #finance #investing #RussianUkrainianWar $AAPL $MSFT $NVDA $AMZN $FB #reddit #forex $GM $F $TSLA $RIVN $LCID $NIO",negative
637,637,637,637,637,637,637,637,637,637,637,637,637,637,637,637,637,637,,,,,,,,,,,,,,Surface Pro X snags a fresh firmware update from February: #MSFT #Microsoft #SurfaceProX #Surface #Office #Windows #NFT #Metaverse #New #Tech #News #Update,postive
638,638,638,638,638,638,638,638,638,638,638,638,638,638,638,638,638,638,,,,,,,,,,,,,,"Selling puts, buying calls, call orders vol &gt; oi $MSFT",neutral
639,639,639,639,639,639,639,639,639,639,639,639,639,639,639,639,639,639,,,,,,,,,,,,,,What about $MSFT ?! Can we short her for a next week 😎,neutral
640,640,640,640,640,640,640,640,640,640,640,640,640,640,640,640,640,640,,,,,,,,,,,,,,MSFT releases fixes for #OMIGOD vulnerability; Blackmatter #ransomware increases their targeting of enterprise businesses; and a Trojanized iTerm2 App targets Mac users in this week’s Threat Intelligence Brief from,negative
641,641,641,641,641,641,641,641,641,641,641,641,641,641,641,641,641,641,,,,,,,,,,,,,,The video game world starts moving to cut off Russia amid outcry over Ukraine war $6758.T-JP $MSFT $undefined $EA $AAPL,negative
642,642,642,642,642,642,642,642,642,642,642,642,642,642,642,642,642,642,,,,,,,,,,,,,,$MSFT Not a lot of huge orders or anything but the first bullish activity I've seen for it so far today $QQQ $SPY,postive
643,643,643,643,643,643,643,643,643,643,643,643,643,643,643,643,643,643,,,,,,,,,,,,,,Entries &amp; exits Daily Discord link below 👇👇👇👇👇📉📉📉 $AAPL $TSLA $AMZN $FB $NFLX $AMD $SPY $MSFT,neutral
644,644,644,644,644,644,644,644,644,644,644,644,644,644,644,644,644,644,,,,,,,,,,,,,,Just published a new blog post on the investments for 2022,postive
645,645,645,645,645,645,645,645,645,645,645,645,645,645,645,645,645,645,,,,,,,,,,,,,,"Hi Vasu, thank you for response and the actions taken. I hope, msft does the right thing in between. No further discussion here.",neutral
646,646,646,646,646,646,646,646,646,646,646,646,646,646,646,646,646,646,,,,,,,,,,,,,,"Microsoft $MSFT completes acquisition of Nuance $NUAN, ushering in new era of outcomes-based AI #dealcompleted",postive
647,647,647,647,647,647,647,647,647,647,647,647,647,647,647,647,647,647,,,,,,,,,,,,,,Enph good for option trading msft to,postive
648,648,648,648,648,648,648,648,648,648,648,648,648,648,648,648,648,648,,,,,,,,,,,,,,"Microsoft (MSFT) Will Suspend All New Sales of Products, Services in Russia - Bloomberg",negative
649,649,649,649,649,649,649,649,649,649,649,649,649,649,649,649,649,649,,,,,,,,,,,,,,"Interestingly, I was advising a company exactly this 2 years ago. (but for slightly different reasons) Hold your own data and services, rather than the SAAS model which seems to be the goto these days. The UK falling out with MSFT is unlikely but not impossible.",postive
650,650,650,650,650,650,650,650,650,650,650,650,650,650,650,650,650,650,,,,,,,,,,,,,,"Our premarket alerts and scalps all panning out: $MSFT $AAPL $LOW and $SPX --- ""Why don't you alert us when you enter these?"" Because I'm setting you up to be consistent and independent. This isn't sports betting -- tailing me or anyone will cost you money in the long run.",negative
651,651,651,651,651,651,651,651,651,651,651,651,651,651,651,651,651,651,,,,,,,,,,,,,,Microsoft halts all new product and service sales in Russia $MSFT $AAPL $GOOGL $ABNB,negative
653,653,653,653,653,653,653,653,653,653,653,653,653,653,653,653,653,653,,,,,,,,,,,,,,BTO TICKER: MSFT PUTS FILL: 3.16 STRIKE: 280 EXP:3/4,postive
654,654,654,654,654,654,654,654,654,654,654,654,654,654,654,654,654,654,,,,,,,,,,,,,,Microsoft halts all new product and service sales in Russia $MSFT Microsoft said it's also stopping many aspects of its business in compliance with government sanctions rules. Do not miss anything 👇,postive
655,655,655,655,655,655,655,655,655,655,655,655,655,655,655,655,655,655,,,,,,,,,,,,,,"$SPX $QQQ lots of downside, no upside all year. No need to own anything as things are undoubtedly getting cheaper. Can probably start buying $AAPL $MSFT $GOOG $COST $JPM after another 10-15% lower.",negative
656,656,656,656,656,656,656,656,656,656,656,656,656,656,656,656,656,656,,,,,,,,,,,,,,Hire a Top US Lawyer Today to Protect Your Portfolio from Lucid Motors Fraud $PYPL $QQQ $SPY $TSLA #news #putin #biden #technology #finance #investing #RussianUkrainianWar $AAPL $MSFT $NVDA $AMZN $FB #reddit #forex $GM $F $TSLA $RIVN $LCID $NIO,neutral
657,657,657,657,657,657,657,657,657,657,657,657,657,657,657,657,657,657,,,,,,,,,,,,,,$msft is kinda forming a descending triangle. I just need it to consolidate more before I enter,negative
658,658,658,658,658,658,658,658,658,658,658,658,658,658,658,658,658,658,,,,,,,,,,,,,,That’s not the point for someone talking logical fallacies you are making two similar but different practices and making them equivalent. Then putting it on MSFT when it was Machinima who was found to be guilty. Is it all corporate Tom foolery ? Yes but accuracy matters,negative
659,659,659,659,659,659,659,659,659,659,659,659,659,659,659,659,659,659,,,,,,,,,,,,,,Lets take a look at FAANG+ YTD: $AAPL is down -8.6% $AMZN is down -13.2% $FB is down -40.0% $GOOGL is down -7.7% $MSFT is down -11.4% $NFLX is down -38.4%,negative
660,660,660,660,660,660,660,660,660,660,660,660,660,660,660,660,660,660,,,,,,,,,,,,,,"$MSFT I believe I posted this a while ago. My 291 KL on $MSFT got triggered today. Took 2 green trades today however my execution was HORRIBLE. Emotions are getting the best of me./ES got rejected at HOD, /NQ made lower high and got rejected at 13950, $MSFT got rejected at VWAP",negative
661,661,661,661,661,661,661,661,661,661,661,661,661,661,661,661,661,661,,,,,,,,,,,,,,"Yes. I switched years ago to all Apple - just easier even though I have mucho respect for MSFT. Now anytime someone presents a Windows laptop my fingers don’t know what to do! 😂 On another note, my husband switched back because of SurfacePro &amp; Studio. They’ve come a long way.",postive
662,662,662,662,662,662,662,662,662,662,662,662,662,662,662,662,662,662,,,,,,,,,,,,,,"I hate to say it, but I believe you're right. I noticed myself - a long time MSFT tolerator - starting to ""feel"" differently about them as a company a few years back. They're serially - and seriously - underestimated right now.",postive
663,663,663,663,663,663,663,663,663,663,663,663,663,663,663,663,663,663,,,,,,,,,,,,,,Can't say that's not possible.. MSFT AMZN... 👀,neutral
664,664,664,664,664,664,664,664,664,664,664,664,664,664,664,664,664,664,,,,,,,,,,,,,,Microsoft completes Nuance buy #Artificial_Intelligence #healthtech $MSFT,postive
665,665,665,665,665,665,665,665,665,665,665,665,665,665,665,665,665,665,,,,,,,,,,,,,,"Top top from last trading session: $GOOG $PYPL $BKNG $MSFT $DWAC Top Flow difference: Auto, Agriculture, Semiconductors Highest per-trade premium * in-flow: $GOOG * out-flow: $PYPL Discover more trends that help you to trade everyday",postive
666,666,666,666,666,666,666,666,666,666,666,666,666,666,666,666,666,666,,,,,,,,,,,,,,$AMZN $MSFT $GOOGL Keys to the market.,neutral
667,667,667,667,667,667,667,667,667,667,667,667,667,667,667,667,667,667,,,,,,,,,,,,,,It really means a lot Also it boosts my confidence I will reach out to you after my preparation Thank you,postive
668,668,668,668,668,668,668,668,668,668,668,668,668,668,668,668,668,668,,,,,,,,,,,,,,#MICROSOFT TO SUSPEND NEW SALES OF PRODUCTS &amp; SERVICES IN RUSSIA ~ BBG $MSFT 🇺🇲 🇷🇺 #RUSSIA,negative
669,669,669,669,669,669,669,669,669,669,669,669,669,669,669,669,669,669,,,,,,,,,,,,,,"Microsoft Stops Sales of Products, Services in Russia $MSFT The tech giant condemns Russia's ""unjustified, unprovoked and unlawful invasion"" of Ukraine. The full take here ✅",negative
670,670,670,670,670,670,670,670,670,670,670,670,670,670,670,670,670,670,,,,,,,,,,,,,,$MSFT Keeping it simple on a Friday.,neutral
671,671,671,671,671,671,671,671,671,671,671,671,671,671,671,671,671,671,,,,,,,,,,,,,,The impact of this on software is going to be fascinating to watch. Does Msft continue to allow their products in RU to hit license servers and continue working? Is that material support? Do they refuse all operating system renewals? Do they still supply security patches to RU?,negative
672,672,672,672,672,672,672,672,672,672,672,672,672,672,672,672,672,672,,,,,,,,,,,,,,Top Hedge Funds Urge Maximum Leverage on Short-Selling Together with Market Orders. $PYPL $QQQ $SPY $TSLA #news #putin #biden #technology #finance #investing #RussianUkrainianWar $AAPL $MSFT $NVDA $AMZN $FB #reddit #forex $GM $F $TSLA $RIVN $LCID $NIO,postive
673,673,673,673,673,673,673,673,673,673,673,673,673,673,673,673,673,673,,,,,,,,,,,,,,How to fix a camera not working on Microsoft Teams: #MSFT #Microsoft #New #Tech #News #Teams #MicrosoftTeams #HowTo #NFT #Metaverse,negative
674,674,674,674,674,674,674,674,674,674,674,674,674,674,674,674,674,674,,,,,,,,,,,,,,"Some companies I'm eyeing for when this market has run it's course. $TGT Target, $CRM Salesforce, $AAPL Apple, $MA Mastercard, $UPS , $MSFT Microsoft. Quality",postive
675,675,675,675,675,675,675,675,675,675,675,675,675,675,675,675,675,675,,,,,,,,,,,,,,$ES $NQ $spy $qqq $spx $ndx testing lows once chicken littles stopped out $aapl $msft $googl $amzn $nvda,negative
676,676,676,676,676,676,676,676,676,676,676,676,676,676,676,676,676,676,,,,,,,,,,,,,,"$MSFT below $290, $GOOGL below $2650, $AMZN below $2900. Make sure to stay out of harm’s way and look for tactical reversals.",negative
677,677,677,677,677,677,677,677,677,677,677,677,677,677,677,677,677,677,,,,,,,,,,,,,,"best way to get rich, be fearful when others are greedy. Be greedy when others are fearful, remember it’s the best way to get rich not the easiest $tsla $fb $baba $msft $cost $aapl $twtr",postive
678,678,678,678,678,678,678,678,678,678,678,678,678,678,678,678,678,678,,,,,,,,,,,,,,Most popular among retail investors (live estimates past hour) 1. $AMD 2. $NIO 3. $MRVL 4. $AVGO 5. $AAPL 6. $COST 7. $BA 8. $TSLA 9. $GPS 10. $MSFT ... 20. $WEAT Follow retail flows,postive
679,679,679,679,679,679,679,679,679,679,679,679,679,679,679,679,679,679,,,,,,,,,,,,,,"Still not working on Chrome, but opened using MSFT Edge.",neutral
680,680,680,680,680,680,680,680,680,680,680,680,680,680,680,680,680,680,,,,,,,,,,,,,,"This means IF you bought a shark-card, you need to stay on the platform you paid for it on. All other money will transfer across. Since it's earned, neither Msft or Sony would be losing out,",postive
681,681,681,681,681,681,681,681,681,681,681,681,681,681,681,681,681,681,,,,,,,,,,,,,,$MSFT Volume as of 10:10 AM calls: 62.94%(1dChg: -2.076%) puts: 37.055%(1dChg: 2.08%) LastPrice: 290.56,negative
682,682,682,682,682,682,682,682,682,682,682,682,682,682,682,682,682,682,,,,,,,,,,,,,,"$MSFT Key News Update Microsoft to suspend all sales, services in Russia Stock alerts, news, and trade ideas at #daytrading #stocks #stockmarket",negative
683,683,683,683,683,683,683,683,683,683,683,683,683,683,683,683,683,683,,,,,,,,,,,,,,"Microsoft to suspend all sales, services in Russia $MSFT Here is all you have to know 👀",negative
684,684,684,684,684,684,684,684,684,684,684,684,684,684,684,684,684,,,,,,,,,,,,,,,Dire Warning! Alex Vieira Sells General Motors Downgrading to Junk. $PYPL $QQQ $SPY $TSLA #news #putin #biden #technology #finance #investing #RussianUkrainianWar $AAPL $MSFT $NVDA $AMZN $FB #reddit #forex $GM $F $TSLA $RIVN $LCID $NIO,postive
685,685,685,685,685,685,685,685,685,685,685,685,685,685,685,685,685,,,,,,,,,,,,,,,look at them levels babyyyy free money every single day sit and wait for the free money $QQQ $SPY $MSFT $AMD,postive
686,686,686,686,686,686,686,686,686,686,686,686,686,686,686,686,686,,,,,,,,,,,,,,,Stock: $MSFT - *** REALTIME TREND *** BUY BUY = 95.00% SELL = 5.00% Try now the Best Pivot Point Calculator!! #tradingview #stocks #stockstowatch,postive
687,687,687,687,687,687,687,687,687,687,687,687,687,687,687,687,687,,,,,,,,,,,,,,,$MSFT ~If you really want to make huge profits on trading then check out this chat......&lt;&lt;&lt;&gt;&gt;&gt;,postive
688,688,688,688,688,688,688,688,688,688,688,688,688,688,688,688,688,,,,,,,,,,,,,,,via Microsoft + Nuance: Better together to transform business and healthcare outcomes with AI,postive
689,689,689,689,689,689,689,689,689,689,689,689,689,689,689,689,689,,,,,,,,,,,,,,,"Flight to quality, war longs: $AAPL $MSFT $NVDA $TSLA $XPEV $BAC $WFC $DAL $WMT $TGT $LOWE $M $DE $TJX",neutral
