,Unnamed: 0,Unnamed: 0.1,Unnamed: 0.1.1,Unnamed: 0.1.1.1,Unnamed: 0.1.1.1.1,Unnamed: 0.1.1.1.1.1,Unnamed: 0.1.1.1.1.1.1,Unnamed: 0.1.1.1.1.1.1.1,Unnamed: 0.1.1.1.1.1.1.1.1,Unnamed: 0.1.1.1.1.1.1.1.1.1,Unnamed: 0.1.1.1.1.1.1.1.1.1.1,Unnamed: 0.1.1.1.1.1.1.1.1.1.1.1,Unnamed: 0.1.1.1.1.1.1.1.1.1.1.1.1,Unnamed: 0.1.1.1.1.1.1.1.1.1.1.1.1.1,Unnamed: 0.1.1.1.1.1.1.1.1.1.1.1.1.1.1,Unnamed: 0.1.1.1.1.1.1.1.1.1.1.1.1.1.1.1,Unnamed: 0.1.1.1.1.1.1.1.1.1.1.1.1.1.1.1.1,Unnamed: 0.1.1.1.1.1.1.1.1.1.1.1.1.1.1.1.1.1,Unnamed: 0.1.1.1.1.1.1.1.1.1.1.1.1.1.1.1.1.1.1,Unnamed: 0.1.1.1.1.1.1.1.1.1.1.1.1.1.1.1.1.1.1.1,Unnamed: 0.1.1.1.1.1.1.1.1.1.1.1.1.1.1.1.1.1.1.1.1,Unnamed: 0.1.1.1.1.1.1.1.1.1.1.1.1.1.1.1.1.1.1.1.1.1,Unnamed: 0.1.1.1.1.1.1.1.1.1.1.1.1.1.1.1.1.1.1.1.1.1.1,Unnamed: 0.1.1.1.1.1.1.1.1.1.1.1.1.1.1.1.1.1.1.1.1.1.1.1,Unnamed: 0.1.1.1.1.1.1.1.1.1.1.1.1.1.1.1.1.1.1.1.1.1.1.1.1,Unnamed: 0.1.1.1.1.1.1.1.1.1.1.1.1.1.1.1.1.1.1.1.1.1.1.1.1.1,Unnamed: 0.1.1.1.1.1.1.1.1.1.1.1.1.1.1.1.1.1.1.1.1.1.1.1.1.1.1,Unnamed: 0.1.1.1.1.1.1.1.1.1.1.1.1.1.1.1.1.1.1.1.1.1.1.1.1.1.1.1,Unnamed: 0.1.1.1.1.1.1.1.1.1.1.1.1.1.1.1.1.1.1.1.1.1.1.1.1.1.1.1.1,Unnamed: 0.1.1.1.1.1.1.1.1.1.1.1.1.1.1.1.1.1.1.1.1.1.1.1.1.1.1.1.1.1,tweets,labels
0,0,0,0,0,0,0,0,0,0,0,0,0,0,0,0,0,0,0,0,0,0,0,0,0,0,0,0,0,1,,Growth Stock ‘Nirvana’ Gives ETF Record Inflow $GOOGL $FB $AMZN $MSFT,postive
1,1,1,1,1,1,1,1,1,1,1,1,1,1,1,1,1,1,1,1,1,1,1,1,1,1,1,1,1,2,,It makes sense for companies &amp; counties with more debt than cash to consider adding a few Bitcoin / Bitcoin Cash ASIC boxes to their operations with goal of paying down debt $BRKA $BRKB $AAPL $MSFT $GOOGL $AMZN $JPM $GS $PYPL $SQ $INTC $IBM $VWELX $VWENX,negative
2,2,2,2,2,2,2,2,2,2,2,2,2,2,2,2,2,2,2,2,2,2,2,2,2,2,2,2,2,,,"$FB, $MSFT, $GOOG, $NVDA, $AMZN below 200sma. Only $AAPL standing",negative
3,3,3,3,3,3,3,3,3,3,3,3,3,3,3,3,3,3,3,3,3,3,3,3,3,3,3,3,,,,$msft Watch our alerts hit the price target. join now,postive
4,4,4,4,4,4,4,4,4,4,4,4,4,4,4,4,4,4,4,4,4,4,4,4,4,4,4,4,,,,"Instead, a few who mined some Bitcoin in their basements for a couple years can now employ 100s of people &amp; work on businesses with 100s of millions, and billions in revenue $BRKA $BRKB $AAPL $MSFT $GOOGL $AMZN $JPM $GS $PYPL $SQ $INTC $IBM $VWELX $VWENX",postive
5,5,5,5,5,5,5,5,5,5,5,5,5,5,5,5,5,5,5,5,5,5,5,5,5,5,5,5,,,,"Glad to know Microsoft is like that! Sometimes it's the manager and the company that make an employee stay! I used to dream about work at another tech company, now I teach in a public school! But I foud as an MIE, that MSFT, really cares about ppl!",postive
6,6,6,6,6,6,6,6,6,6,6,6,6,6,6,6,6,6,6,6,6,6,6,6,6,6,6,6,,,,while doing their main job like Computer Programming: They were supposed to maybe get a side job mining Coal or something while making sure Big Tech systems work 24/7 $BRKA $BRKB $AAPL $MSFT $GOOGL $AMZN $JPM $GS $PYPL $SQ $INTC $IBM $VWELX $VWENX,postive
7,7,7,7,7,7,7,7,7,7,7,7,7,7,7,7,7,7,7,7,7,7,7,7,7,7,7,7,,,,"U.S., China in Talks to Add Concession on Cloud Computing in Trade Deal $MSFT $AMZN $AAPL",postive
8,8,8,8,8,8,8,8,8,8,8,8,8,8,8,8,8,8,8,8,8,8,8,8,8,8,8,8,,,,"They wouldn't have. They were supposed to maybe get less than $40,000 a year, &amp; be in debt for 20 years &amp; look for a second and third job, $BRKA $BRKB $AAPL $MSFT $GOOGL $AMZN $JPM $GS $PYPL $SQ $INTC $IBM $VWELX $VWENX",negative
9,9,9,9,9,9,9,9,9,9,9,9,9,9,9,9,9,9,9,9,9,9,9,9,9,9,9,9,,,,A reason for this is because a lot of very smart Computer Science pros have $BTC &amp; $BCH wealth now $BRKA $BRKB $AAPL $MSFT $GOOGL $AMZN $JPM $GS $PYPL $SQ $INTC $IBM $VWELX $VWENX,neutral
10,10,10,10,10,10,10,10,10,10,10,10,10,10,10,10,10,10,10,10,10,10,10,10,10,10,10,10,,,,"Bitcoin &amp; Bitcoin Cash can create new companies with 1,000s of jobs &amp; also add 100s of new jobs to existing big companies $BRKA $BRKB $AAPL $MSFT $GOOGL $AMZN $JPM $GS $PYPL $SQ $INTC $IBM $VWELX $VWENX",postive
11,11,11,11,11,11,11,11,11,11,11,11,11,11,11,11,11,11,11,11,11,11,11,11,11,11,11,11,,,,$MSFT Real price will come out soon; Follow price targets....,neutral
12,12,12,12,12,12,12,12,12,12,12,12,12,12,12,12,12,12,12,12,12,12,12,12,12,12,12,,,,,The World’s Biggest Corporate Borrowers Are Dominated by Tech $JNJ $MSFT $UBER $CMCSA $GE,negative
13,13,13,13,13,13,13,13,13,13,13,13,13,13,13,13,13,13,13,13,13,13,13,13,13,13,13,,,,,Watch this weekly video to learn: * What Time Trades forecasts for March 16 * Gaps over magic levels We went 3/3 in Indian stock forecasts last week! $NET $QQQ $SPY $AAPL $GOOGL $MSFT $NVDA $TSLA $BTC $LUNA $XRP $NIFTY,neutral
14,14,14,14,14,14,14,14,14,14,14,14,14,14,14,14,14,14,14,14,14,14,14,14,14,14,14,,,,,"$xop 15 Year Monthly $spy $qqq $iwm $dia $tsla $aapl $amzn $twtr $fb $msft $nflx $nvda $goog $amd $adbe $f $crm $orcl $panw JC is saying above this line, #wtfo",postive
15,15,15,15,15,15,15,15,15,15,15,15,15,15,15,15,15,15,15,15,15,15,15,15,15,15,15,,,,,need that win.,postive
16,16,16,16,16,16,16,16,16,16,16,16,16,16,16,16,16,16,16,16,16,16,16,16,16,16,16,,,,,While Contemplates CBDC &amp; Blockchain It Makes Sense To Use Bitcoin $BTC &amp; Bitcoin Cash $BCH $BRKA $BRKB $AAPL $MSFT $GOOGL $AMZN $JPM $GS $PYPL $SQ $INTC $IBM,postive
17,17,17,17,17,17,17,17,17,17,17,17,17,17,17,17,17,17,17,17,17,17,17,17,17,17,17,,,,,$spy $qqq $iwm $dia $tsla $aapl $amzn $twtr $fb $msft $nflx $nvda $goog $amd $adbe $f $crm $orcl $panw $gcc Willow Tree Commodity Daily Last week a sharp rise?,postive
18,18,18,18,18,18,18,18,18,18,18,18,18,18,18,18,18,18,18,18,18,18,18,18,18,18,18,,,,,"180 days in at 💪 In the six months I have been here , I have learnt so much! I certified in Cloud Adoption Framework,Well Architected Framework, Became A Certified CSA and obtained my MCT badge! I’m surrounded by such amazing people! #MSFT",postive
19,19,19,19,19,19,19,19,19,19,19,19,19,19,19,19,19,19,19,19,19,19,19,19,19,19,19,,,,,"Custom #MSFT plates, nice!",postive
20,20,20,20,20,20,20,20,20,20,20,20,20,20,20,20,20,20,20,20,20,20,20,20,20,20,20,,,,,This is a *great* story. Thank You Ben for sharing and caring. #MSFT is one of the BEST companies out there. #Microsoft ❤️ 🟥🟩 🟦🟨,postive
21,21,21,21,21,21,21,21,21,21,21,21,21,21,21,21,21,21,21,21,21,21,21,21,21,21,21,,,,,I wonder if the new Lenovo ThinkPad X13s is an indication that MSFT might soon sell a Windows ARM license?,postive
22,22,22,22,22,22,22,22,22,22,22,22,22,22,22,22,22,22,22,22,22,22,22,22,22,22,22,,,,,$dia $tsla $aapl $amzn $twtr $fb $msft $nflx $nvda $goog $amd $adbe $f $crm $orcl $panw Monthly over 6 years $iwf : $iwd Double Top Large Cap Growth : Value red $tnx cyan 2 year treasury yield,postive
23,23,23,23,23,23,23,23,23,23,23,23,23,23,23,23,23,23,23,23,23,23,23,23,23,,,,,,,"$OKTA trend setter, $80B TAM.. targeting $5B rev in next few years. $MSFT competition was a risk few years back, but continuous innovation leaves Microsoft behind.",neutral
24,24,24,24,24,24,24,24,24,24,24,24,24,24,24,24,24,24,24,24,24,24,24,24,24,,,,,,,"Why Apple, Microsoft And Other Big Buyback Stocks Are Crushing The S&amp;P 500's Returns $PKW $MSFT $AAPL $JPM",neutral
25,25,25,25,25,25,25,25,25,25,25,25,25,25,25,25,25,25,25,25,25,25,25,25,25,,,,,,,$MSFT~If you really want to make huge profits on trading then check out this chat;,neutral
26,26,26,26,26,26,26,26,26,26,26,26,26,26,26,26,26,26,26,26,26,26,26,26,26,,,,,,,$MSFT Waiting for Short signal on MSFT .Chart by,postive
27,27,27,27,27,27,27,27,27,27,27,27,27,27,27,27,27,27,27,27,27,27,27,27,27,,,,,,,Active options: AAPL TSLA F AMD SNOW SOFI NVDA RIVN MSFT MU FB BAC AMC OXY BBY NIO AMZN PLTR KR INTC,neutral
28,28,28,28,28,28,28,28,28,28,28,28,28,28,28,28,28,28,28,28,28,28,28,28,28,,,,,,,"I mean, ""their P/Es will be 10% below their pre-pandemic P/E highs"", not their prices. So, it is around 147 for $AAPL and 269 for $MSFT at the lowest.",negative
31,31,31,31,31,31,31,31,31,31,31,31,31,31,31,31,31,31,31,31,31,31,31,31,31,,,,,,,$BA: Boeing (Weekly) 👇 $NQ_F $XLK $AAPL $MSFT $NFLX $FB $AMZN $BA $TSLA .,negative
32,32,32,32,32,32,32,32,32,32,32,32,32,32,32,32,32,32,32,32,32,32,32,32,32,,,,,,,"All blue chips started broke, yet there are only handful of blue-chips. There are 40 over 200B MC, about 150 over 100B. You know why because most of them don't make it to promise land. We only look at MSFT AMZN GOOGL but 99% had their couple quarters to couple years fame &amp; gone",postive
33,33,33,33,33,33,33,33,33,33,33,33,33,33,33,33,33,33,33,33,33,33,33,33,33,,,,,,,$MSFT is now paying us to use Bing for search. Solid business model 🤪,postive
34,34,34,34,34,34,34,34,34,34,34,34,34,34,34,34,34,34,34,34,34,34,34,34,34,,,,,,,New market transaction for house rep: Donald Sternoff Beyer. Sell $MSFT $15001 - $50000 on Feb 28 Owner: joint Sell $MS $1001 - $15000 on Feb 02 Owner: joint Sell $MSCI $1001 - $15000 on Feb 03 Owner: joint Sell $MSCI $15001 - $50000 on Feb 28 Owner: joint,postive
35,35,35,35,35,35,35,35,35,35,35,35,35,35,35,35,35,35,35,35,35,35,35,35,35,,,,,,,Show me where msft spent $500 million? Stop with that nonsense.,negative
36,36,36,36,36,36,36,36,36,36,36,36,36,36,36,36,36,36,36,36,36,36,36,36,36,,,,,,,"Hey funny how time passes... through my growing respect for via &amp; your ""on-the-record we will never sell to MSFT"" throwaway comment makes me smile at the weirdness of this whole timeline 🙃",negative
37,37,37,37,37,37,37,37,37,37,37,37,37,37,37,37,37,37,37,37,37,37,37,37,37,,,,,,,Microsoft Corp - $MSFT 💰 QUOTE $MSFT was DOWN ⬇ on Fri Mar 04 Closed at 289.86 USD for a -2.05% loss from previous close 📉 📉 📉 📊 ANALYSIS Microsoft Corp should be nationalized ☭ ☭ ☭,negative
40,40,40,40,40,40,40,40,40,40,40,40,40,40,40,40,40,40,40,40,40,40,40,40,40,,,,,,,"Keep in mind, sometimes you can work in platform and you want to work on larger architecture. If MSFT doesn’t have that alignment, it might make sense to move on",postive
41,41,41,41,41,41,41,41,41,41,41,41,41,41,41,41,41,41,41,41,41,41,41,41,41,,,,,,,"Thanks for the reassuring words. Still trying to find my style. I’m getting better at reading charts. My thing is how to find the potential movers. Lol I’ve decided to focus on three tickets. AAPL, TSLA, and MSFT. Im should look at other sector movers too when there is rotations.",postive
42,42,42,42,42,42,42,42,42,42,42,42,42,42,42,42,42,42,42,42,42,42,42,42,42,,,,,,,"Microsoft Corp. (MSFT) surprised the market with Q4 result. Morgan Stanley changed the rating to Buy, as Microsoft Corp. (MSFT) is undervalued given its projected growth.",postive
43,43,43,43,43,43,43,43,43,43,43,43,43,43,43,43,43,43,43,43,43,43,43,43,43,,,,,,,"Just for this huge gesture on part of ms in his crunch time(h1b kind of situation), the employee owes it and should decide to stay back at msft. I probably would have done that in his situation.",neutral
44,44,44,44,44,44,44,44,44,44,44,44,44,44,44,44,44,44,44,44,44,44,44,44,44,,,,,,,"Microsoft Corp. (MSFT) surprised the market with Q4 result. Goldman Sachs changed the rating to Sell, as Microsoft Corp. (MSFT) shed 29.2% of their value last month.",postive
45,45,45,45,45,45,45,45,45,45,45,45,45,45,45,45,45,45,45,45,45,45,45,45,45,,,,,,,"Microsoft Corp. (MSFT) surprised the market with Q2 result. Deutsche bank changed the rating to Sell, as Microsoft Corp. (MSFT) shed 29.2% of their value last month.",postive
47,47,47,47,47,47,47,47,47,47,47,47,47,47,47,47,47,47,47,47,47,47,47,47,47,,,,,,,Path from compromised #Vmware #ESX to #Microsoft #DomainController compromise actually is a highway. #TrustEverybodyButCutTheCard #cybersecurity #msft #activedirectory,postive
48,48,48,48,48,48,48,48,48,48,48,48,48,48,48,48,48,48,48,48,48,48,48,48,48,,,,,,,My vote goes to $MSFT $AAPL $GOOGL $EVVTY continue to outperform $SPY. That’s my hope at least ;) positions weighed in this order,postive
49,49,49,49,49,49,49,49,49,49,49,49,49,49,49,49,49,49,49,49,49,49,49,49,49,,,,,,,Started an account for the kids - bought a share of $AAPL $DIS $MSFT $DOCN.,postive
51,51,51,51,51,51,51,51,51,51,51,51,51,51,51,51,51,51,51,51,51,51,51,51,51,,,,,,,XP does not have msft monitoring software installed. Much of the world still runs on XP and it's arguable that there have been zero meaningful improvements to windows since XP. Producing drivers for new (post2016) hardware would restore XP to a viable alternative.,negative
53,53,53,53,53,53,53,53,53,53,53,53,53,53,53,53,53,53,53,53,53,53,53,53,53,,,,,,,GM! Another friend of mine just quit msft and joined web3 full force 🥳🥳🥳 #Web3 #NFTCollection #NFTs #Metaverse,negative
54,54,54,54,54,54,54,54,54,54,54,54,54,54,54,54,54,54,54,54,54,54,54,54,54,,,,,,,How to force specific wallpaper in Windows and prevent users from changing it,neutral
55,55,55,55,55,55,55,55,55,55,55,55,55,55,55,55,55,55,55,55,55,55,55,55,55,,,,,,,Microsoft (MSFT) Stock: $380 Price Target And Buy Rating,postive
57,57,57,57,57,57,57,57,57,57,57,57,57,57,57,57,57,57,57,57,57,57,57,57,57,,,,,,,"It's true that money doesn't buy happiness. But less financial problems will always result in a less stressful life. And the less stress you have, the more time you have to be happy. $AAPL $MSFT $GOOGL $AMZN $FB $AMC $BABA $TSLA $NDVA $JPM $JNJ $WMT $UNH $MA $HD $TSLA $WFC",neutral
58,58,58,58,58,58,58,58,58,58,58,58,58,58,58,58,58,58,58,58,58,58,58,58,58,,,,,,,10 most mentioned US stocks on Reddit in past 24 hours: 1. $GME : 49 2. $SPY : 31 3. $AREN : 20 4. $VTI : 18 5. $CAT : 16 6. $AMC : 14 7. $RSX : 13 8. $AAPL : 12 9. $TSLA : 12 10. $MSFT : 11 #stock #trading #usstock #stockmarket,postive
59,59,59,59,59,59,59,59,59,59,59,59,59,59,59,59,59,59,59,59,59,59,59,59,59,,,,,,,"Massachusetts AG to #investigate social media site's impact on teens as big tech responds to Russia-Ukraine #conflict. Find out more in ""#SocialStocks"" weekly from $FB $GOOG $GOOGL $TWTR $SNAP $MSFT $ZM $PINS $AAPL",postive
60,60,60,60,60,60,60,60,60,60,60,60,60,60,60,60,60,60,60,60,60,60,60,60,60,,,,,,,"Bear Market Conditions that could turn #bullish 💯 - Russian De-Escalation (Rally Upside) ✅ - Fed Hikes (Inevitable) 😕 - Inflation (Inevitable / 6 Month) 💹 Big ""Ifs""... 🇷🇺🤬 #NoWar #Ukraine️ $qqq $dji $spy $aapl $goog $amzn $crm $upst $msft",postive
61,61,61,61,61,61,61,61,61,61,61,61,61,61,61,61,61,61,61,61,61,61,61,61,61,,,,,,,HOW TO BECOME WEALTHY: - Invest at least 20% of your income -Invest into Index Funds - Keep your expenses low - Invest long-term - Start early as possible - Maximize tax-advantaged accounts (like 401ks &amp; Roth IRAs) - Buy Real Estate - Avoid debt $AAPL $MSFT $GOOGL $AMZN,postive
64,64,64,64,64,64,64,64,64,64,64,64,64,64,64,64,64,64,64,64,64,64,64,64,64,,,,,,,Even the MSFT charity matching program now has a warning for Russian citizens to have caution when making donations due to local law 😢,negative
65,65,65,65,65,65,65,65,65,65,65,65,65,65,65,65,65,65,65,65,65,65,65,65,65,,,,,,,😁 I understand. I have two MSFT accounts and it's like magic how I stay logged in from multiple devices. It's miraculous. 🙏😂,neutral
66,66,66,66,66,66,66,66,66,66,66,66,66,66,66,66,66,66,66,66,66,66,66,66,66,,,,,,,"What a stupid idea. (Not the FDE by default, but storing the recovery key in an opaque cloud service.) There are cases where the bootloader can prompt for it... pretty sure I wouldn't have IP connectivity to MSFT's cloud at that point -_-;",negative
67,67,67,67,67,67,67,67,67,67,67,67,67,67,67,67,67,67,67,67,67,67,67,67,67,,,,,,,"$ETSY isn’t appealing to me from their business model. I will stick to $MSFT, $AAPL and $GOOG",neutral
68,68,68,68,68,68,68,68,68,68,68,68,68,68,68,68,68,68,68,68,68,68,68,68,68,,,,,,,$MSFT 35% / 36x $ETSY 71% / 30x $AAPL 35x / 26x What would a portfolio with just these 11 companies return in the next 5 years?,neutral
69,69,69,69,69,69,69,69,69,69,69,69,69,69,69,69,69,69,69,69,69,69,69,69,69,,,,,,,Weekly update on big tech stocks. $AAPL $MSFT $GOOGL $TSLA $NVDA $TSM $AMD $QCOM $ADBE $SPY $QQQ,neutral
70,70,70,70,70,70,70,70,70,70,70,70,70,70,70,70,70,70,70,70,70,70,70,70,70,,,,,,,"I believe that Apple tweet by was more directed at Microsoft. The Apple not being far from tree of Apples, MSFT.",postive
71,71,71,71,71,71,71,71,71,71,71,71,71,71,71,71,71,71,71,71,71,71,71,71,71,,,,,,,"To see which stocks TipRanks investors traded in the volatile month of February, we looked at the Buy &amp; Sell transactions of more than 1/2 mil investors who hold a TipRanks Smart Portfolio. $FB $NVDA $TSLA $NIO $MSFT $GOOGL $PYPL $AMZN $SoFi $AAPL $AMD",postive
72,72,72,72,72,72,72,72,72,72,72,72,72,72,72,72,72,72,72,72,72,72,72,72,72,,,,,,,"94% of actively managed funds have underperformed the S&amp;P 500 over the past 20 years. On average, these funds charged investors more than 10 times as much as a low-cost index fund for the privilege of underperformance. $AAPL $MSFT $GOOGL $AMZN $FB $AMC $BABA $TSLA $NDVA $JPM",postive
73,73,73,73,73,73,73,73,73,73,73,73,73,73,73,73,73,73,73,73,73,73,73,73,73,,,,,,,One thing I didn’t like about jobs is: You could work 10 times harder than the next man and you still get paid the same. #investing $AAPL $MSFT $GOOGL $AMZN $FB $AMC $BABA $TSLA $NDVA $JPM $JNJ $WMT $UNH $MA $HD $TSLA $WFC $VZ $NFLX $BAC $AA $TTM $DIS $INTC $F $A $S $PLUG $ME,negative
74,74,74,74,74,74,74,74,74,74,74,74,74,74,74,74,74,74,74,74,74,74,74,74,74,,,,,,,"The pandemic is over. It’s now an endemic. MSFT, AAPL, back to office April. Airline masks set to expire soon is last domino to fall. Lots of research/data coming highlighting harm done to kids and young people including how remote work slows learning during first job.",postive
75,75,75,75,75,75,75,75,75,75,75,75,75,75,75,75,75,75,75,75,75,75,75,75,75,,,,,,,$MSFT *Real price will come out soon; Follow price target..,neutral
76,76,76,76,76,76,76,76,76,76,76,76,76,76,76,76,76,76,76,76,76,76,76,76,76,,,,,,,Top 5 trending #redditarmy #stocks in the last 4 hours | Sym |ChtVol | %chg |🚀 🐻 &gt;&gt; | $GME | 17 | 41.7% | 🚀 | $SPY | 17 | 88.9% | 🚀 | $AMC | 6 | 100.0% | 🚀 | $MSFT | 6 | 50.0% | 🚀 | $ITM | 5 | 66.7% | 🚀 Access wider trends:,postive
77,77,77,77,77,77,77,77,77,77,77,77,77,77,77,77,77,77,77,77,77,77,77,77,77,,,,,,,Top 5 trending #redditarmy #stocks in the last 4 hours | Sym |ChtVol | %chg |🚀 🐻 &gt;&gt; | $GME | 17 | 30.8% | 🚀 | $SPY | 15 | 66.7% | 🚀 | $AMC | 6 | 100.0% | 🚀 | $MSFT | 6 | 50.0% | 🚀 | $VOO | 5 | 400.0% | 🚀 Access wider trends:,postive
78,78,78,78,78,78,78,78,78,78,78,78,78,78,78,78,78,78,78,78,78,78,78,78,78,,,,,,,Top 5 trending #redditarmy #stocks in the last 4 hours | Sym |ChtVol | %chg |🚀 🐻 &gt;&gt; | $GME | 17 | 21.4% | 🚀 | $SPY | 15 | 66.7% | 🚀 | $AMC | 6 | 100.0% | 🚀 | $MSFT | 6 | 50.0% | 🚀 | $RH | 5 | 400.0% | 🚀 Access wider trends:,postive
81,81,81,81,81,81,81,81,81,81,81,81,81,81,81,81,81,81,81,81,81,81,81,81,81,,,,,,,Really enjoyed this podcast. His portfolio is unique: 25% $MSFT $AMZN $GOOG 35% Rails 40% Energy &amp; Materials Especially enjoyed the conversation on the rail industry. This portfolio could be set up really good for the next 5-10 years.,postive
83,83,83,83,83,83,83,83,83,83,83,83,83,83,83,83,83,83,83,83,83,83,83,83,83,,,,,,,"In line with the other #StockMarket indices the candles for $DJI are also making lower highs/lows and also have the #deathcross forming 👀 RSI trending lower with room to drop more, MACD sorting lower and lower 🕯️📉↘️ Not great news for $GS $HD $MSFT $MCD $V $CRM $CAT $BA",negative
84,84,84,84,84,84,84,84,84,84,84,84,84,84,84,84,84,84,84,84,84,84,84,84,84,,,,,,,"$MSFT closed the weekly below 50 MA and closed the daily below 200 DMA. Nothing bullish. Expect another leg down, as forecasted earlier.",negative
85,85,85,85,85,85,85,85,85,85,85,85,85,85,85,85,85,85,85,85,85,85,85,85,85,,,,,,,"First of three charts is the #NASDAQ with clear lower highs/lows 📉👀 RSI room to go lower, MACD finding its way ↘️ The arrow is pointing to the 50 day SMA crossing below the 200 day SMA #deathcross Levels below that I see: 13140, 12587, 11955 $AAPL $MSFT $AMZN $TSLA $GOOGL",negative
86,86,86,86,86,86,86,86,86,86,86,86,86,86,86,86,86,86,86,86,86,86,86,86,86,,,,,,,"Looking at #StockMarket indices and unsure why anyone would think we've hit a bottom 📉 Lower highs and lower lows ↘️ Many #stocks are in this downtrend $TSLA $NVDA $FB $MSFT $JPM $F and also $BTC ↘️ When #investing or #trading in a downtrend, I look to the candles🕯️📈",negative
87,87,87,87,87,87,87,87,87,87,87,87,87,87,87,87,87,87,87,87,87,87,87,87,87,,,,,,,"So by request I am going to share them weekly w/examples. These are from my Alerts, not the discussed ones from chart set ups or other analysts in my server. Noteable: The loss in MSFT went green after I cut. These are not ""Max Gains"". Some given Live for Free on",negative
88,88,88,88,88,88,88,88,88,88,88,88,88,88,88,88,88,88,88,88,88,88,88,88,88,,,,,,,"Why is this surprising? Bill is one of the richest individuals in the US, and he has a Family Office called Cascade Investments. They have a diversified portfolio as they have sold down MSFT shares and invested in lots of other stuff, including Farmland.",postive
93,93,93,93,93,93,93,93,93,93,93,93,93,93,93,93,93,93,93,93,93,93,93,93,93,,,,,,,"Activision intends to #delay next year's ""Call of Duty"" #title for the first time in nearly 20 years. More in ""Game On,"" weekly from $SONY $SQNXF $NTDOY $MSFT $ATVI $TTWO $EA $TCEHY $UBSFY $NCBDY",postive
94,94,94,94,94,94,94,94,94,94,94,94,94,94,94,94,94,94,94,94,94,94,94,94,94,,,,,,,"$AMD $HPQ $F are the only ones I’ve added to recently until this geopolitical crisis has settled down. After this settles down, more $MSFT $NVDA $ADBE $INTU and possibly more $AMZN",postive
95,95,95,95,95,95,95,95,95,95,95,95,95,95,95,95,95,95,95,95,95,95,95,95,95,,,,,,,"So that I’m following along correctly, MSFT has bottomed potentially which means it could be set for a new leg higher, yet ur Amazon chart is setup for it to go down into the ditches?",postive
97,97,97,97,97,97,97,97,97,97,97,97,97,97,97,97,97,97,97,97,97,97,97,97,97,,,,,,,To choose 3 of the world’s most dominant companies $AAPL $GOOG $MSFT with the widest moats and trading at &lt;30x earnings to illustrate your point about market exuberance isn’t something that strikes me as genius…,postive
98,98,98,98,98,98,98,98,98,98,98,98,98,98,98,98,98,98,98,98,98,98,98,98,98,,,,,,,That’s fair but you now more than ever you have the attention of MSFT Teams. The Five9 deal was a big blow against their expansion. Lots of companies with pristine balance sheets don’t explode higher. The macro backdrop is not prime for ZM to run again anytime soon. RNG too.,postive
99,99,99,99,99,99,99,99,99,99,99,99,99,99,99,99,99,99,99,99,99,99,99,99,99,,,,,,,$MSFT~If you really want to make huge profits on trading then check out this chat;,postive
100,100,100,100,100,100,100,100,100,100,100,100,100,100,100,100,100,100,100,100,100,100,100,100,100,,,,,,,"$MSFT I've made $175K with them, By their alert. If you really want to make a huge profit on trading. Choose this professional chat.",postive
101,101,101,101,101,101,101,101,101,101,101,101,101,101,101,101,101,101,101,101,101,101,101,101,101,,,,,,,$MSFT ~If you really want to make huge profits on trading then check out this chat,postive
102,102,102,102,102,102,102,102,102,102,102,102,102,102,102,102,102,102,102,102,102,102,102,102,102,,,,,,,$MSFT ~If you really want to make huge profits on trading then check out this chat,postive
103,103,103,103,103,103,103,103,103,103,103,103,103,103,103,103,103,103,103,103,103,103,103,103,103,,,,,,,$MSFT bottomed at its 70 week MA on February 24. The week ended with a bullish engulfing candle which means it probably was a weekly cycle low. This week it was rejected by its 10 week MA. A close above the 10 WMA will confirm the weekly cycle low is in.,negative
104,104,104,104,104,104,104,104,104,104,104,104,104,104,104,104,104,104,104,104,104,104,104,104,104,,,,,,,"This was a human problem, not a political one. MSFT decided to go the extra mile for an employee that needed help on the way out the door. That action reflects very well on the corporate culture there.",postive
105,105,105,105,105,105,105,105,105,105,105,105,105,105,105,105,105,105,105,105,105,105,105,105,105,,,,,,,"Is $MSFT STILL IN OPERATION in Russia? If so, why? #PutinWarCrimes #UkraineStrong",negative
106,106,106,106,106,106,106,106,106,106,106,106,106,106,106,106,106,106,106,106,106,106,106,106,106,,,,,,,"RTC over public network will only get more challenging as public network gets more congested+ lack of investment. 5G will exacerbate problem. Managed virtual networks best solution. $MSFT, $ZM, $API, $NET (?) are best of breed.",negative
107,107,107,107,107,107,107,107,107,107,107,107,107,107,107,107,107,107,107,107,107,107,107,107,107,,,,,,,"I mean there are stock and sector specific exceptions in both directions. I’m talking clean, safe stories. Msft now trades at 20x 23. Could it go down another 10-12 and trade at 17-18x? That’s about as clean as you get. Other stuff will over shoot more but won’t feel clean.",postive
108,108,108,108,108,108,108,108,108,108,108,108,108,108,108,108,108,108,108,108,108,108,108,108,108,,,,,,,"$MSFT built their network years ago to compete with $CSCO ""IPcallmanager"" and are reaping the benefits with Teams. $GOOG chose the WebRTC over public network approach, which has proven unreliable under anything but optimal conditions. 1/",postive
109,109,109,109,109,109,109,109,109,109,109,109,109,109,109,109,109,109,109,109,109,109,109,109,109,,,,,,,"$MSFT Very strong, often overlooked, not one of the cool kids... but printing money.",postive
