1687,1687,1687,1687,1687,1687,,,,,,,,,,,,,,,,,,,,,,,,,,"$MSFT - Althoff Judson sold 2725.998 shares of Common Stock worth $810,466.47 in 1 transaction(s) on 2022-02-28",postive
1688,1688,1688,1688,1688,1688,,,,,,,,,,,,,,,,,,,,,,,,,,"$MSFT Closed above 300 but barely. Lets see if it continues to chug along. Rejected from 301.47 today, if it can break above that looking for 303, then 305. Break below 299 looking for 296.36 then 293.72",negative
1689,1689,1689,1689,1689,1689,,,,,,,,,,,,,,,,,,,,,,,,,,How to Follow the Smart Money $GS $MSFT $GOOGL $AMZN $FB $BBY $SPY $GOOG $AAPL $BBWI $LNG $TSLA #stocks #investing #valueinvesting #,postive
1690,1690,1690,1690,1690,1690,,,,,,,,,,,,,,,,,,,,,,,,,,The Companies Pulling Their Business From Russia After The Ukraine Invasion $AAPL $GOOGL $GOOG $MSFT $DELL,negative
1691,1691,1691,1691,1691,1691,,,,,,,,,,,,,,,,,,,,,,,,,,"✅ $MSFT: ""Microsoft"" mentioned during Inc. earnings event",postive
1692,1692,1692,1692,1692,1692,,,,,,,,,,,,,,,,,,,,,,,,,,"lol what, more people buying MULN then Berkshire makes perfect sense. A Russian etf trading more shares then MSFT basically never happens. Also, no data is meaningless in this game.",postive
1693,1693,1693,1693,1693,1693,,,,,,,,,,,,,,,,,,,,,,,,,,Today's Top Bullish Flow... 🐂 $NVDA $C $DWAC $AAPL $ZEN $MSFT #options #stockmarket #wallstreet #nasdaq #nyse #fintech #blackbox,postive
1694,1694,1694,1694,1694,1694,,,,,,,,,,,,,,,,,,,,,,,,,,"No, MSFT might as well get paid instead of not getting paid. The Russians likely have the keys to the MSFT products anyway.",postive
1695,1695,1695,1695,1695,1695,,,,,,,,,,,,,,,,,,,,,,,,,,Snowflake shares plunge 30% on forecast for weaker growth $MSFT $AMZN,negative
1696,1696,1696,1696,1696,1696,,,,,,,,,,,,,,,,,,,,,,,,,,Deathcross. Damn it…. My msft calls I held overnight is fucked. I hope it does a quick retreat in the AM to get myself out with some profits.,negative
1697,1697,1697,1697,1697,1697,,,,,,,,,,,,,,,,,,,,,,,,,,"Could someone who uses $snow lmk why the cloud offerings of GOOG, MSFT, AMZN etc. not simply replace it? I understand it's compatible/neutral with those... but can those larger competitors simply undercut SNOW's offering?",negative
1698,1698,1698,1698,1698,1698,,,,,,,,,,,,,,,,,,,,,,,,,,Convictionの高い銘柄 $MSFT $GOOGL $TSLA $NVDA $ABNB $COIN $U,negative
1699,1699,1699,1699,1699,1699,,,,,,,,,,,,,,,,,,,,,,,,,,"$SNOW Isn't this what happened when $MSFT reported, and then it ripped a new asshole in the bears? 😀",negative
1700,1700,1700,1700,1700,1700,,,,,,,,,,,,,,,,,,,,,,,,,,"I install Google Drive, OneDrive, and iCloud Drive, let them fight it out and then back up the result to S3. Disclaimer, I own stock in $GOOG, $MSFT, $AAPL, and $AMZN.",postive
1701,1701,1701,1701,1701,1701,,,,,,,,,,,,,,,,,,,,,,,,,,How the largest stocks performed today Apple $AAPL +2.1% Microsoft $MSFT +1.8% Google $GOOGL +0.4% Amazon $AMZN +0.6% Tesla $TSLA +1.8% Berkshire $BRK.B +2.2% Nvidia $NVDA +3.2% Meta $FB $META +2.3% Taiwan Semi $TSM +1.4% UnitedHealth $UNH +1.9% Visa $V -0.2% $JNJ +1.2%,postive
1702,1702,1702,1702,1702,1702,,,,,,,,,,,,,,,,,,,,,,,,,,Trending Stocks on #fintwit: Source: 1. $SNOW 🥇 2. $TSLA 🥈 3. $SPY 🥉 4. $QQQ 5. $SPX 6. $CPNG 7. $SKYH 8. $AMD 9. $UPST 10. $MSFT ( Sorted by most recent ),postive
1703,1703,1703,1703,1703,1703,,,,,,,,,,,,,,,,,,,,,,,,,,"..also wonder if a full set is ever worth 50ETH on the open market, what’s the entire franchise worth to an entity like $MSFT $RBLX $ATVI",neutral
1705,1705,1705,1705,1705,1705,,,,,,,,,,,,,,,,,,,,,,,,,,"MSFT: Has 181,000 employees Also MSFT: Created Outlook ~32 years ago Also MSFT: Brags about AI chops Also MSFT: Can't handle Outlook basic search needs 🤯",postive
1706,1706,1706,1706,1706,1706,,,,,,,,,,,,,,,,,,,,,,,,,,Did you account for the price difference? MSFT is $300..,postive
1707,1707,1707,1707,1707,1707,,,,,,,,,,,,,,,,,,,,,,,,,,This is my conundrum...sold some msft and pubm and got lucky on the dip to 2x my shares at $190....trying to see what else to sell should $Snow take a morning nose dive on stop limits,postive
1708,1708,1708,1708,1708,1708,,,,,,,,,,,,,,,,,,,,,,,,,,"End support for MSFT in Russia, please.",postive
1709,1709,1709,1709,1709,1709,,,,,,,,,,,,,,,,,,,,,,,,,,can you expand on the giant moat? who do they compete with? Internet listed GOOGL MSFT and etc,neutral
1710,1710,1710,1710,1710,1710,,,,,,,,,,,,,,,,,,,,,,,,,,$MSFt settled +1.8% to $300.19. Bulls need &gt;315 to be decisive... and that looks overly difficult.,negative
1711,1711,1711,1711,1711,1711,,,,,,,,,,,,,,,,,,,,,,,,,,"$MSFT As long as the 1/25 low remains intact, the instrument remains in the sideways zone. We don’t like to trade the sideways area, only like to trade the extreme areas in 3, 7 or 11 swing. #Elliottwave #Trading #Stocks",neutral
1712,1712,1712,1712,1712,1712,,,,,,,,,,,,,,,,,,,,,,,,,,Could you guys PLEASE come up with an alternative for QuickBooks? I am SO done with the pirates at Intuit! You could easily take 1/2 their market in a year with a viable alternative.,postive
1713,1713,1713,1713,1713,1713,,,,,,,,,,,,,,,,,,,,,,,,,,$MSFT Awaiting Short Signal. Free 7-Day Trail at,postive
1714,1714,1714,1714,1714,1714,,,,,,,,,,,,,,,,,,,,,,,,,,"They’re trying to make it do things I don’t need it to do and, tbh, Evernote has gotten expensive. OneNote I get for free with the other MSFT stuff I have.",postive
1715,1715,1715,1715,1715,1715,,,,,,,,,,,,,,,,,,,,,,,,,,"TICKER: $MSFT SIZE: 340,000 PRICE: $297.88 TIME: 12:51:42 AMOUNT: $101,279,200",postive
1716,1716,1716,1716,1716,1716,,,,,,,,,,,,,,,,,,,,,,,,,,Selective list of tech stocks with positive earnings and guidance for 2022 and names to focus on during heightened volatility $AMD $TSLA $GOOGL $UPST $MSFT $ETSY $CRM $MELI $DIS $EXPE $TTD $SQ $ZS done well since Earnings dip,postive
1717,1717,1717,1717,1717,1717,,,,,,,,,,,,,,,,,,,,,,,,,,#RT RT CapEx for hyperscalers: 2021 2022E 2022E $FB: $19B $30B $31B AWS: $21B $27B $33B $GOOG: $25B $31B $33B $MSFT: $23B $24B $31B The cloud transition plows onward - the world ca…,postive
1718,1718,1718,1718,1718,1718,,,,,,,,,,,,,,,,,,,,,,,,,,One would look at the chart for $MSFT and think it's reversing but this algoflow makes me flip bearish/proceed long with extreme caution,negative
1719,1719,1719,1719,1719,1719,,,,,,,,,,,,,,,,,,,,,,,,,,"TICKER: $MSFT SIZE: 340,000 PRICE: $297.88 TIME: 12:51:42 AMOUNT: $101,279,200",postive
1720,1720,1720,1720,1720,1720,,,,,,,,,,,,,,,,,,,,,,,,,,"A few years ago, there was a lot of talk about how this-stock or that-stock could be the next trillion dollar company. The chatter was almost entirely dominated by technology-focused businesses (AAPL, MSFT, FB, GOOGL, BABA, AMZN, NVDA, etc). * Berkshire has entered the chat... *",postive
1721,1721,1721,1721,1721,1721,,,,,,,,,,,,,,,,,,,,,,,,,,$spy Infinite amount of space in the fucking clouds; it's a commoditized business at best; $amzn huge security risk to our country; stock is headed to 1700ish; THIS YEAR; $msft &lt;200 both are CERTAINTIES; $crm finished; out of business and Benoff in prison 2 years max!,postive
1722,1722,1722,1722,1722,1722,,,,,,,,,,,,,,,,,,,,,,,,,,"The extension ""Capgemini Microsoft UK Build and Release Tools"" from capgemini-msft-uk has been updated to version 1.0.15. Link: #DeployTask #UtilityTask",postive
1723,1723,1723,1723,1723,1723,,,,,,,,,,,,,,,,,,,,,,,,,,If it doesn’t get there happy to let it pass and continue owning $MSFT $AMZN $GOOGL,postive
1724,1724,1724,1724,1724,1724,,,,,,,,,,,,,,,,,,,,,,,,,,r/WallStreetBets daily discussion mentions over the last hour (rank 11-20) 11. $NVDA (5 mentions) 12. $RIVN (4) 13. $IPO (4) 14. $QQQ (3) 15. $PYPL (3) 16. $FB (3) 17. $RKT (3) 18. $RSX (3) 19. $WISH (3) 20. $MSFT (3) Full live &amp; historical data at,postive
1725,1725,1725,1725,1725,1725,,,,,,,,,,,,,,,,,,,,,,,,,,S&amp;P 500 Map at close by #SP500 #SPX500 #SPX $MSFT $AAPL $GOOGL $FB $AMZN $DIS $V $TSLA $JPM $KO $T $ORCL $VZ $MMM $SPY $UNH $DHR $TMO $MU $CAT $PG $TMO $CVX $NKE $D $CRM $MRK $ABBV $DWAC $XOM $COST $DG $LOW $CSCO $BA $DUK $HD $MA $NFLX $WMT $JNJ $PFE $ABT $PYPL $BAC,neutral
1726,1726,1726,1726,1726,1726,,,,,,,,,,,,,,,,,,,,,,,,,,"Goldberg AV, Tarjan RE (1988) Finding minimum-cost circulations by canceling negative cycles. Proc. 20th ACM Symposium on the Theory of Computing, pp 388–397. Full paper: J ACM (1989) 36:873–886 $FB $MSFT #connectedhubs",negative
1728,1728,1728,1728,1728,1728,,,,,,,,,,,,,,,,,,,,,,,,,,Alphabet (Google) Stock Should Be on Every Technology Investor’s Radar Now -- article I wrote for $GOOG $GOOGL $MSFT $SPY $QQQ $DIA $DJIA #stockmarket #investing #finance #stocks $AAPL $TSLA $AMZN $INTC $NFLX $AMC $NIO $GME,postive
1729,1729,1729,1729,1729,1729,,,,,,,,,,,,,,,,,,,,,,,,,,"What I love is that with Win11 they're kinda back at where they where with Win7, only with a distinct MacOS flavour to it. Supposedly MacBooks are really popular among the Windows devs/designers at MSFT... just a rumour :)",neutral
1730,1730,1730,1730,1730,1730,,,,,,,,,,,,,,,,,,,,,,,,,,I’ve got a spare $300 to invest into the market. Which of these stocks would you purchase right now? $ABBV $AAPL $V $JNJ $MSFT $PEP Pick one if you’d like!,neutral
1731,1731,1731,1731,1731,1731,,,,,,,,,,,,,,,,,,,,,,,,,,"this is really aimed at msft: kcls computer isp. I have had a terrible time trying to relay documents on google drive to be access on library computers? these are my documents, not yours, so remove your illegal restrictions now.",negative
1732,1732,1732,1732,1732,1732,,,,,,,,,,,,,,,,,,,,,,,,,,Yeah $SNOW quarter disaster should also drag down $MSFT. Okay. Get bent.,neutral
1733,1733,1733,1733,1733,1733,,,,,,,,,,,,,,,,,,,,,,,,,,"Then again that's my feeling with a lot of the new stuff these days. A lot of it feels just like 'new for the sake of new'. Much like how MSFT has been stumbling from terrible UI paradigm to terrible UI paradigm since Win7 now, along with the rest of the industry...",postive
1734,1734,1734,1734,1734,1734,,,,,,,,,,,,,,,,,,,,,,,,,,MSFT mkt cap 2.7 Tn. TWTR 27bn. It’s affordable but why would they want it.,postive
1735,1735,1735,1735,1735,1735,,,,,,,,,,,,,,,,,,,,,,,,,,"Buy Today 2000 model:['PYPL', 'MSFT', 'INTC', 'AMD', 'TSLA', 'FB']Buy today basic model:['PYPL', 'MSFT', 'INTC', 'AMD', 'NKE', 'AMZN', 'FB']",postive
1736,1736,1736,1736,1736,1736,,,,,,,,,,,,,,,,,,,,,,,,,,Does anyone else read $MSFT as “misfit” instead of “Microsoft”?,negative
1737,1737,1737,1737,1737,1737,,,,,,,,,,,,,,,,,,,,,,,,,,CapEx for hyperscalers: 2021 2022E 2022E $FB: $19B $30B $31B AWS: $21B $27B $33B $GOOG: $25B $31B $33B $MSFT: $23B $24B $31B The cloud transition plows onward - the world can't build digital infra fast enough.,postive
1738,1738,1738,1738,1738,1738,,,,,,,,,,,,,,,,,,,,,,,,,,"Gasp! Finally. To be fair to most other “office” tool makers, Google is kinda slow to come around. MSFT, Notion, Confluence, Coda, etc. looking at this like 🙄",postive
1739,1739,1739,1739,1739,1739,,,,,,,,,,,,,,,,,,,,,,,,,,Companies suspension of sales or prod in Russia: $Aapl $Dell $msft $googl $Gm $F $Ttm $Hog $hmc $Tm $Shell $Xom $Dis $T $Sony $Nke $Addy $Ups $Fdx $Nok $Eric,neutral
1740,1740,1740,1740,1740,1740,,,,,,,,,,,,,,,,,,,,,,,,,,"Yeah, whether it's VC runtimes or CLR runtimes, MSFT does make your life hell with their special sauce libs. Also pity the foo' who bought into the MFC hype, I guess :)",postive
1741,1741,1741,1741,1741,,,,,,,,,,,,,,,,,,,,,,,,,,,"Yeah, I much prefer the 14 years it took my $MSFT position to return to ATHs after the 2000 crash. It would have been hell to ride that up to ATHs nearly every year if I had to look back and see it fall 50-80% in between ATHs 😉",postive
1742,1742,1742,1742,1742,,,,,,,,,,,,,,,,,,,,,,,,,,,For the ppl selling after hours $MSFT is not $SNOW $MSFT is not $SNOW $MSFT is not $SNOW $MSFT is not $SNOW $MSFT is not $SNOW $MSFT is not $SNOW $MSFT is not $SNOW $MSFT is not $SNOW $MSFT is not $SNOW $MSFT is not $SNOW,negative
1743,1743,1743,1743,1743,,,,,,,,,,,,,,,,,,,,,,,,,,,MSFT continues to improve the MIP experience: Co-authoring on MIP encrypted documents is in preview on mobile devices,postive
1744,1744,1744,1744,1744,,,,,,,,,,,,,,,,,,,,,,,,,,,Microsoft rolling out new endpoint security solution for SMBs: #MSFT #Microsoft #New #Tech #News #SMB #Defender #CyberSecurity #Office #Windows #NFT #Metaverse,postive
1745,1745,1745,1745,1745,,,,,,,,,,,,,,,,,,,,,,,,,,,"Market this week has maintained its position of investors not making up their mind on where they want it to go. Put signs yesterday, stronger call signs today. Bought some call action for Friday with little buying power. Apple $170 Tna $66 Msft $307.5 #NoSweat",postive
1746,1746,1746,1746,1746,,,,,,,,,,,,,,,,,,,,,,,,,,,"If we’re green tomorrow, I might begin my scales in $MSFT &amp; $AAPL long term puts.",neutral
1747,1747,1747,1747,1747,,,,,,,,,,,,,,,,,,,,,,,,,,,Bargain hunters showing up in MSFT. Generational type buying oppurtunity,postive
1748,1748,1748,1748,1748,,,,,,,,,,,,,,,,,,,,,,,,,,,"The usual suspects. Aka: AMD, NVDA, MSFT, FB, TSLA,",postive
1749,1749,1749,1749,1749,,,,,,,,,,,,,,,,,,,,,,,,,,,small wins +$4.9k nice $tsla call out today by B. holding $msft $nvda and fraction of $tsla calls overnight for a possible gap up. playing smaller here in this news driven environment. ty B 🙏 $tsla 900c (+$6.1k) $msft 302.5c (holding) $nvda 245c (holding),postive
1750,1750,1750,1750,1750,,,,,,,,,,,,,,,,,,,,,,,,,,,"3/2/22 - Went long ""MSFT"" at $300.41 with the following signal = Close under and back over the 200 sma. Emergency stop = $282.64 and end of day stop is a close back below the 200 sma.",postive
1751,1751,1751,1751,1751,,,,,,,,,,,,,,,,,,,,,,,,,,,"Yeah Bandcamp was unsustainable with the percentage of the proceeds that they pay out. Were always gonna have to sell to someone, Epic is way better for artists than if it had been Spotify, Apple, MSFT, Google, Meta.",postive
1752,1752,1752,1752,1752,,,,,,,,,,,,,,,,,,,,,,,,,,,"$AAPL Apple's Rise to The Top of Gaming Because of hefty fees, Apple made more profits off of games than some of the most reputable gaming companies who designed them. In 2019, Apple generated $2bn more in operating profit than Nintendo, $MSFT, Sony, and $ATVI —combined.",postive
1753,1753,1753,1753,1753,,,,,,,,,,,,,,,,,,,,,,,,,,,"#HotOptions Report For End Of Day, March 2, 2022 – $TSLA, $AAPL, $AMD, $F, $SOFI, $NVDA, $AMC, $C, $FB, $BAC, $INTC, $MSFT, $PLTR, $MU, $XOM, $NIO, $JPM, $JWN, $PARA, $OXY",postive
1754,1754,1754,1754,1754,,,,,,,,,,,,,,,,,,,,,,,,,,,Check out the Top WhaleFlow from today! Sign up for #WhaleStream &amp; get a FREE WEEK to see all the #WhaleFlow in Real-Time! $SPX $SPY $TSLA $QQQ $PYPL $IWM $AAPL $RUT $RSX $VIX $MSFT $GLD $NVDA $DVN $AMD,postive
1756,1756,1756,1756,1756,,,,,,,,,,,,,,,,,,,,,,,,,,,$TLT absolutely wrecked not a great sign for Tech with $MSFT and $GOOGL under major resistance.,postive
1757,1757,1757,1757,1757,,,,,,,,,,,,,,,,,,,,,,,,,,,#BREAKING Snowflake Shares Crash on Brutal Earnings Miss. Legendary Free Earnings Call. Short at ANY PRICE! MASSIVE CRASH AHEAD $SNOW #earnings $OKTA #finance #investing $TSLA $AAPL $MSFT,negative
1758,1758,1758,1758,1758,,,,,,,,,,,,,,,,,,,,,,,,,,,Nasdaq sees Nuance trading to be halted March 3 in anticipation of deal closing $NUAN $MSFT,postive
1759,1759,1759,1759,1759,,,,,,,,,,,,,,,,,,,,,,,,,,,"In this week's Threat Intelligence Brief: #FortiGuardLabs' global threat landscape report, a wiper #malware targets Ukrainian interests, and a MSFT IIS RCE vulnerability is explored. Read more:",postive
1760,1760,1760,1760,1760,,,,,,,,,,,,,,,,,,,,,,,,,,,Todays plays 🐼 $MSFT 302.5c hit +15% so far (2.14 to 2.45). Can see 303 if markets continue higher tomorrow. Only alert for today. Keeping it light and simple for now. Have a great rest of the day everyone!,postive
1761,1761,1761,1761,1761,,,,,,,,,,,,,,,,,,,,,,,,,,,"$NUAN Anticipated Last Trading Date: March 3, 2022 $MSFT #mergerarb",postive
1762,1762,1762,1762,1762,,,,,,,,,,,,,,,,,,,,,,,,,,,"#MFAAAANNGT $MSFT $FB $AMZN $APPL $AMD $NVDA $NFLX $GOOGL $TSLA $ARRK $SPY $QQQ $YM $NQ $ES $SOFI $PLTR That's the wrap, last 5 minutes rug pull Nice Green candles Let's see what overnight brings... Know your risks",postive
1763,1763,1763,1763,1763,,,,,,,,,,,,,,,,,,,,,,,,,,,#SocialStocks: Massachusetts AG to investigate TikTok's impact on teens $FB $GOOG $GOOGL $TWTR $SNAP $MSFT $ZM $PINS $AAPL,neutral
1764,1764,1764,1764,1764,,,,,,,,,,,,,,,,,,,,,,,,,,,"$MSFT Lovely S&amp;M/sales steadily coming down over the past 5y Revenue g stable for a few yrs after the 2017 issues Recently, rev g rocketing up while S&amp;M/sales going down ✅ Azure gives you wings 😀",postive
1765,1765,1765,1765,1765,,,,,,,,,,,,,,,,,,,,,,,,,,,Do you want to succeed with #AI? Read my latest interview with for all the secrets. #TPSS #futureofwork #sustainability #cloud #PeggySmedley #podcast #MSInnovation #MicrosoftAI #MicrosoftInfluencer,postive
1766,1766,1766,1766,1766,,,,,,,,,,,,,,,,,,,,,,,,,,,Best Microsoft Surface Laptop deals for March 2022: #MSFT #Microsoft #Surface #Windows #New #Tech #News #WFH #Office #NFT #Metaverse,postive
1767,1767,1767,1767,1767,,,,,,,,,,,,,,,,,,,,,,,,,,,*MYMEDICALHUB PARTNERS WITH MICROSOFT TO EXTEND MICROSOFT CLOUD $MSFT,postive
1768,1768,1768,1768,1768,,,,,,,,,,,,,,,,,,,,,,,,,,,Max profit potential for today's alerts: $MSFT $AMZN $QCOM $DWAC $BYND $TSLA,postive
1769,1769,1769,1769,1769,,,,,,,,,,,,,,,,,,,,,,,,,,,#SocialStocks: Massachusetts AG to investigate TikTok's impact on teens $FB $GOOG $GOOGL $TWTR $SNAP $MSFT $ZM $PINS $AAPL,postive
1770,1770,1770,1770,1770,,,,,,,,,,,,,,,,,,,,,,,,,,,Avg time spent in Zoom is much higher than teams. $ZM $MSFT,postive
1771,1771,1771,1771,1771,,,,,,,,,,,,,,,,,,,,,,,,,,,You still think $MSFT is overvalued?,neutral
1772,1772,1772,1772,1772,,,,,,,,,,,,,,,,,,,,,,,,,,,"Disturbing to see Win10 stop supporting software like Dependency Walker in its recent updates. Gives the feeling that MSFT is moving into breaking changes with Windows. All the fun of Linux dev, except monitored from the MSFT Cloud...",postive
1773,1773,1773,1773,1773,,,,,,,,,,,,,,,,,,,,,,,,,,,You guys know I’m not a big fan of after what he did to me &amp; thousands of my coworkers in 2015 with the unnecessary mass layoffs to rally MSFT stock price but nobody should ever have to lose their child &amp; my heart bleeds for him right now 💔,postive
1774,1774,1774,1774,1774,,,,,,,,,,,,,,,,,,,,,,,,,,,"Top % Increase in Option Volume for $FANG, $PYPL, $INCY, $DLTR, $MU, $GOOGL, $FDX, $AMZN, $AMD, $MSFT, $NFLX, $NVDA, $FB, $FTNT",postive
1775,1775,1775,1775,1775,,,,,,,,,,,,,,,,,,,,,,,,,,,$LEDS moving on up! #Lowfloat Do own DD! $BA $UPST $PCG $DWAC $LDRS $PENN $AMZN $AMC $GME $FSR $SNDL $CTRM $MSFT $ENDP $LMFA $CEI $NIO $RIOT $TSLA $SBTX $SOS $GOOG $DKNG $GREE $PLTR $HOOD $LCID $AAPL #Robinhood,postive
1776,1776,1776,1776,1776,,,,,,,,,,,,,,,,,,,,,,,,,,,"Microsoft Corp. (MSFT) surprised the market with Q2 result. Morgan Stanley changed the rating to Underperform, as Microsoft Corp. (MSFT) is trading at over 80 times its book value with a trailing PE of over 40.",postive
1777,1777,1777,1777,1777,,,,,,,,,,,,,,,,,,,,,,,,,,,$MSFT Interesting. Very interesting.,postive
1778,1778,1778,1778,1778,,,,,,,,,,,,,,,,,,,,,,,,,,,You can now browse the Windows 11 app store via your web browser: #MSFT #Microsoft #New #Tech #News #Windows #Store #WindowsStore #Office #NFT #Metaverse,postive
1779,1779,1779,1779,1779,,,,,,,,,,,,,,,,,,,,,,,,,,,Are you struggling to identify the most important areas to watch at market open based on a stocks historical price data? We created the #PIVOTPRO indicator for just this purpose. Works on ANY stock 😎 $AMC $MSFT $SPY,postive
1780,1780,1780,1780,1780,,,,,,,,,,,,,,,,,,,,,,,,,,,"the backwards thing again. the A in MGGA is Apple?: msft gme goog appl get ready, buckle up",negative
1781,1781,1781,1781,1781,,,,,,,,,,,,,,,,,,,,,,,,,,,~When I was novice I made a lot of mistakes then I came to know about this $SPY $MSFT $AAPL $TSLA $AMZN $FB $NFLX $AMD,negative
1782,1782,1782,1782,1782,,,,,,,,,,,,,,,,,,,,,,,,,,,Stock: $MSFT - *** REALTIME TREND *** SELL BUY = 5.00% SELL = 95.00% Try now the Best Pivot Point Calculator!! #tradingview #stocks #stockstowatch,postive
1783,1783,1783,1783,1783,,,,,,,,,,,,,,,,,,,,,,,,,,,S&amp;M/sales over 5 yrs These are examples where this ratio is going down. Ie getting more efficient $MSFT - beautiful $CRWD - very good $NOW - also very good $SNOW - going down nicely but still relatively early days (Charts from ),postive
1784,1784,1784,1784,1784,,,,,,,,,,,,,,,,,,,,,,,,,,,"$MSFT, 8d support bounce and break above 200d and 20d. Watching for FTD and entry tomorrow. Nice Raindrop chart from",postive
1785,1785,1785,1785,1785,,,,,,,,,,,,,,,,,,,,,,,,,,,RT US stocks OVERVALUED by 50% since WWIII started on Feb 24th The US and EU have to step in with COMPLETE EMBARGO on Russia and get ready for the NUCLEAR WAR $QQQ $MSFT $GOOG $AAPL $AMZN $NFLX $TSLA $FB,negative
1786,1786,1786,1786,1786,,,,,,,,,,,,,,,,,,,,,,,,,,,RT US stocks OVERVALUED by 50% since WWIII started on Feb 24th The US and EU have to step in with COMPLETE EMBARGO on Russia and get ready for the NUCLEAR WAR $QQQ $MSFT $GOOG $AAPL $AMZN $NFLX $TSLA $FB,negative
1787,1787,1787,1787,1787,,,,,,,,,,,,,,,,,,,,,,,,,,,At some point they're gonna buy back all those cheap shares Or get bought by $GOOG or $MSFT,postive
1788,1788,1788,1788,1788,,,,,,,,,,,,,,,,,,,,,,,,,,,$FB $AMZN $AAPL $NVDA $GOOG $MSFT $TSLA vs. $XLE Breakdown or Fake-down?,neutral
1789,1789,1789,1789,1789,,,,,,,,,,,,,,,,,,,,,,,,,,,"[ *VIDEO* ] ""Psst! Sell Signals Everyone Should Know - #AMZN - #AMAZON"" $FB, $UBER, $NVDA, $TSLA, $TAN, $GRPN, $INTC, $PLUG, $CCL, $ITUB, $MGM, $NCLH, $SNAP, $T, $UAL, $MRO, $MSFT, $Z, $ABEV, $M, $ET, $GSX, $AMC, $BDB, $FLSY, $DBX, $PFE, $C, $NOK",postive
1791,1791,1791,1791,1791,,,,,,,,,,,,,,,,,,,,,,,,,,,"Nasdaq Composite attempting to break 13,800 after holding 13,600 as support. A move above this level would be the most bullish move we have had in almost a month. Adding exposure to $MSFT, $AMZN, $AAPL, $UPST, $GOOG, $NVDA, $AMD, and $SPY",postive
1792,1792,1792,1792,1792,,,,,,,,,,,,,,,,,,,,,,,,,,,#MFAAAANNGT $MSFT $FB $AMZN $APPL $AMD $NVDA $NFLX $GOOGL $TSLA $ARRK $SPY $QQQ $YM $NQ $ES $SOFI $PLTR Possible rug pull by close? Know your risks,negative
1793,1793,1793,1793,1793,,,,,,,,,,,,,,,,,,,,,,,,,,,The longer you wait more you will lose. Divine profits daily. Follow Biden and Pelosi #biden #trump $QQQ $SPY #russia #putin #ukraine $DIA #investing $DE $AAPL $TSLA $NVDA $MSFT #news #Pelosi,postive
1794,1794,1794,1794,1794,,,,,,,,,,,,,,,,,,,,,,,,,,,$MSFT at this position is back over 300 nice…… 🏼,postive
1795,1795,1795,1795,1795,,,,,,,,,,,,,,,,,,,,,,,,,,,"The cybersecurity sector is a pocket of strength in a volatile market, says With geopolitical tensions continuing to drive headlines, Ives tells why cybersecurity stocks are poised for growth moving forward. 🔒 $ZS $PANW $CYBR $MSFT 🔒",postive
1796,1796,1796,1796,1796,,,,,,,,,,,,,,,,,,,,,,,,,,,"Was able to get in early before the beautiful run up. Added: MSFT, V, VOO, RY, MS and AAPL. 1-2 shares each.",postive
1797,1797,1797,1797,1797,,,,,,,,,,,,,,,,,,,,,,,,,,,$MSFT Volume as of 03:11 PM calls: 64.84% puts: 35.16% LastPrice: 300.71,postive
1798,1798,1798,1798,1798,,,,,,,,,,,,,,,,,,,,,,,,,,,"pls, ama deadass start a gofundme for a couch i absolutely cannot deal with the prices 😭",postive
1800,1800,1800,1800,1800,,,,,,,,,,,,,,,,,,,,,,,,,,,Come on MSFT: Most of the shit that fouls up the cyberworld AND YOUR SOFTWARE comes from Russian* hacking. Take. Them. Out.... and I don't mean to dinner and a movie.,negative
1801,1801,1801,1801,1801,,,,,,,,,,,,,,,,,,,,,,,,,,,New dTokens will be added soon on #DeFiChain #RoadTo50 $MSFT $FB $NFLX $VOO $DFI 🚀 #Bitcoin,postive
1802,1802,1802,1802,1802,,,,,,,,,,,,,,,,,,,,,,,,,,,Bullish on $TSLA $RKT $COOP $MSFT $EIX $ZM $DKNG $CRSR $HLGN $DNA today..,postive
1803,1803,1803,1803,1803,,,,,,,,,,,,,,,,,,,,,,,,,,,"$MSFT ""Waiting for SHORT signal on MSFT Register for 7-Day Trial Access at """,postive
1804,1804,1804,1804,1804,,,,,,,,,,,,,,,,,,,,,,,,,,,"Windows 11 Dev Channel build 22567 brings cleaner ""open with"" dialog, new smart app control settings, more: #MSFT #Microsoft #New #Tech #News #Windows #Office #Dev #NFT #Metaverse",postive
1805,1805,1805,1805,1805,,,,,,,,,,,,,,,,,,,,,,,,,,,RT US stocks OVERVALUED by 50% since WWIII started on Feb 24th The US and EU have to step in with COMPLETE EMBARGO on Russia and get ready for the NUCLEAR WAR $QQQ $MSFT $GOOG $AAPL $AMZN $NFLX $TSLA $FB,negative
1807,1807,1807,1807,1807,,,,,,,,,,,,,,,,,,,,,,,,,,,THE CHANCES OF A RUSSIA-BACKED CYBER ATTACK... HIGH. $CYBR $MSFT $PANW $TENB $TLS $ZS #MarketUpdate #MarketUpdate #UkraineRussiaWar,negative
1808,1808,1808,1808,1808,,,,,,,,,,,,,,,,,,,,,,,,,,,"$msft vs $FB in the metaverse world, let us see who will dominate. For now I am going with $MSFT.",postive
1809,1809,1809,1809,1809,,,,,,,,,,,,,,,,,,,,,,,,,,,"In my whole life, I have known no wise people who didn't read all the time, none, zero. —Charlie Munger #biden #trump $QQQ $SPY #russia #putin #ukraine $DIA #investing $DE $AAPL $TSLA $NVDA $MSFT #news",postive
1810,1810,1810,1810,1810,,,,,,,,,,,,,,,,,,,,,,,,,,,Would you take this portfolio long from here? $AAPL $MSFT $AMZN $GOOG $TSLA $NVDA $BRKB $UNH $COST $MAR $F $LYV $CNC $ABBV $KO $PAWN $GBTC,postive
1811,1811,1811,1811,1811,,,,,,,,,,,,,,,,,,,,,,,,,,,"The leaders are telling you we're going higher, $AAPL, $TSLA, $MSFT, $GS, $AMZN, etc...",postive
1812,1812,1812,1812,1812,,,,,,,,,,,,,,,,,,,,,,,,,,,Words out! #MSFT,postive
1813,1813,1813,1813,1813,,,,,,,,,,,,,,,,,,,,,,,,,,,$MSFT Volume collecting above resistance after fighting with the 200 day sma 🎈,postive
1814,1814,1814,1814,1814,,,,,,,,,,,,,,,,,,,,,,,,,,,Just a thought $MSFT,neutral
